{
  "version": "2.0.0",
  "status": "CURRENT",
  "bundle_model": "REVIEWED_EXECUTION_PROJECTION_WITH_INDEPENDENT_DOMAIN_EXCLUSION_V2",
  "promotion_rule": "BYTE_COPY_EXCEPT_EXACT_CROSS_CONTRACT_HELD_SOURCE_BLOCK_EXCLUSION",
  "lifecycle": {
    "source_contract": "SOURCE_READY",
    "execution": "EXECUTION_BLOCKED",
    "review": "SOURCE_REVIEW_REQUIRED",
    "apply_admitted": false
  },
  "authority_boundary": {
    "executor_state": "BLOCKED_NOT_INCLUDED",
    "provider_connectivity_included": false,
    "credentials_included": false,
    "sql_execution_authorized": false,
    "deployment_authorized": false,
    "production_authorized": false
  },
  "immutable_package": {
    "migration_count": 122,
    "source_counts": {
      "discordos": 17,
      "fitness": 101,
      "mazer": 4
    },
    "migration_package_sha256": "b65d1c0b73607218cc37826d9bb77c25704ea18f957abba7b5667a79d0a2c8db",
    "governance_manifest_sha256": "82e7ecad9a68addff14c43c3bc237c54af2dd5d48cda454c0e1c121a3e4536ec",
    "standard_migration_sql_count": 0
  },
  "statement_denominator": {
    "source_statement_count": 1253,
    "historical_executable_statement_count": 721,
    "historical_held_statement_count": 532,
    "execution_exclusion_statement_count": 28,
    "executable_statement_count": 693,
    "held_statement_count": 560,
    "promoted_statement_count": 693
  },
  "artifacts": [
    {
      "ordinal": 1,
      "source_path": "bootstrap/artifacts/inert-sql/00000000000001_mazer_schema_inert.sql",
      "promoted_path": "bootstrap/artifacts/executable-sql/00000000000001_mazer_schema.sql",
      "source_bytes": 16387,
      "bytes": 16387,
      "source_sha256": "fbea0ff8306f0a0f2f577fa0c259649329a183644673ab1a3bc282e081755313",
      "promoted_sha256": "fbea0ff8306f0a0f2f577fa0c259649329a183644673ab1a3bc282e081755313",
      "expected_promoted_sha256": "fbea0ff8306f0a0f2f577fa0c259649329a183644673ab1a3bc282e081755313",
      "byte_identical": true,
      "projection": {
        "mode": "BYTE_COPY"
      }
    },
    {
      "ordinal": 2,
      "source_path": "bootstrap/artifacts/inert-sql/00000000000002_fitness_schema_inert.sql",
      "promoted_path": "bootstrap/artifacts/executable-sql/00000000000002_fitness_schema.sql",
      "source_bytes": 148809,
      "bytes": 148809,
      "source_sha256": "5fe4ef8fbd9a1e873cd0f8f385b4128d3450c01f6a4d0e6eaae1c6943a1c4c9b",
      "promoted_sha256": "5fe4ef8fbd9a1e873cd0f8f385b4128d3450c01f6a4d0e6eaae1c6943a1c4c9b",
      "expected_promoted_sha256": "5fe4ef8fbd9a1e873cd0f8f385b4128d3450c01f6a4d0e6eaae1c6943a1c4c9b",
      "byte_identical": true,
      "projection": {
        "mode": "BYTE_COPY"
      }
    },
    {
      "ordinal": 3,
      "source_path": "bootstrap/artifacts/inert-sql/00000000000003_discordos_schema_inert.sql",
      "promoted_path": "bootstrap/artifacts/executable-sql/00000000000003_discordos_schema.sql",
      "source_bytes": 20670,
      "bytes": 15796,
      "source_sha256": "5b2783d8f6a78a2a9898c94559b31c168dcb1b5deebc1546365c1c8f09ade79f",
      "promoted_sha256": "236656c35f51fae81eb33aa887fd88d710559c169a6a1a7c466586fab949caf6",
      "expected_promoted_sha256": "236656c35f51fae81eb33aa887fd88d710559c169a6a1a7c466586fab949caf6",
      "byte_identical": false,
      "projection": {
        "mode": "EXACT_SOURCE_BLOCK_EXCLUSION",
        "source_migration_path": "supabase/migrations/20260615034751_discordos_music_sesh_storage.sql",
        "excluded_statement_count": 28,
        "excluded_statement_set_sha256": "a4ce7457186e84058645dc8366ce41e41a51641d8ae34b97c61b416692f0a482"
      }
    },
    {
      "ordinal": 4,
      "source_path": "bootstrap/artifacts/inert-sql/00000000000004_platform_security_overlay_inert.sql",
      "promoted_path": "bootstrap/artifacts/executable-sql/00000000000004_platform_security_overlay.sql",
      "source_bytes": 2507,
      "bytes": 2507,
      "source_sha256": "f3cf571b37a6aa756c72ec398fa0f24f26b3d93bff2a768a318ceb87aa9ece64",
      "promoted_sha256": "f3cf571b37a6aa756c72ec398fa0f24f26b3d93bff2a768a318ceb87aa9ece64",
      "expected_promoted_sha256": "f3cf571b37a6aa756c72ec398fa0f24f26b3d93bff2a768a318ceb87aa9ece64",
      "byte_identical": true,
      "projection": {
        "mode": "BYTE_COPY"
      }
    }
  ],
  "ordered_artifact_set_sha256": "8a7c2a9ca2a85ec2ca59de503036ecfead19be4163acb43df020442f5c70c19c",
  "contract_bindings": [
    {
      "role": "DISPOSABLE_TARGET_BOOTSTRAP",
      "path": "contracts/v1/bootstrap/disposable-target-bootstrap-contract.json",
      "sha256": "d217f31885f995e939d8e37c07ef5201bef43934227564a9083b662b2054c869",
      "bytes": 20850,
      "observed_sha256": "d217f31885f995e939d8e37c07ef5201bef43934227564a9083b662b2054c869"
    },
    {
      "role": "AUTH_APP_DATA_REHEARSAL",
      "path": "contracts/v1/rehearsal/auth-app-data-rehearsal-contract.json",
      "sha256": "47db976f08e98e8d7821e1007e942355f912af86a3ef6c229b3b7772e91b6402",
      "bytes": 24361,
      "observed_sha256": "47db976f08e98e8d7821e1007e942355f912af86a3ef6c229b3b7772e91b6402"
    },
    {
      "role": "STORAGE_EDGE_REALTIME_EXECUTION_DENOMINATOR",
      "path": "contracts/v1/rehearsal/storage-edge-realtime-execution-denominator-contract.json",
      "sha256": "713e4911fcda8f222b35fa1746e8f46ea58247a273ac666bd5f10b7e0efbd65a",
      "bytes": 32362,
      "observed_sha256": "713e4911fcda8f222b35fa1746e8f46ea58247a273ac666bd5f10b7e0efbd65a"
    },
    {
      "role": "INDEPENDENT_BACKUP",
      "path": "contracts/v1/recovery/independent-backup-contract.json",
      "sha256": "a627535f8f48d0c14b81a6bb611bf4f36935af96a66beb1d6a23096df4c2fd10",
      "bytes": 11060,
      "observed_sha256": "a627535f8f48d0c14b81a6bb611bf4f36935af96a66beb1d6a23096df4c2fd10"
    },
    {
      "role": "RLS_GRANT_FUNCTION_MATRIX",
      "path": "contracts/v1/security/rls-grant-function-matrix.json",
      "sha256": "c309ab9e1c4c5313e4817f8b6eccaaeb186886141cb3d65da9b8a5dc4740856e",
      "bytes": 10389,
      "observed_sha256": "c309ab9e1c4c5313e4817f8b6eccaaeb186886141cb3d65da9b8a5dc4740856e"
    }
  ],
  "contract_binding_set_sha256": "ccdbb34684853b338bad6c893b9c5aecf8760ca91e514de295b9ed4d7cfca758",
  "expected_effects_and_rollback_bindings": [
    {
      "role": "EXPECTED_DATA_EFFECTS",
      "path": "bootstrap/manifests/data-effects.v1.json",
      "sha256": "1d28080e416eb59f639c9db4514d9c9e4e978d8650c2137f0a170440eba25d85",
      "bytes": 253261,
      "observed_sha256": "1d28080e416eb59f639c9db4514d9c9e4e978d8650c2137f0a170440eba25d85"
    },
    {
      "role": "STATEMENT_DISPOSITIONS",
      "path": "bootstrap/manifests/dispositions.v1.json",
      "sha256": "129ff967d9333c38c5356a1c5309361c368c6ee0552bfc9f2c84624defbc396c",
      "bytes": 519712,
      "observed_sha256": "129ff967d9333c38c5356a1c5309361c368c6ee0552bfc9f2c84624defbc396c"
    },
    {
      "role": "EXPECTED_SOURCE_OBJECTS",
      "path": "bootstrap/manifests/source-objects.v1.json",
      "sha256": "1e26a2c50f5415ced0a5100556d85c5f0f66e12baede0b705771e570906d369e",
      "bytes": 377924,
      "observed_sha256": "1e26a2c50f5415ced0a5100556d85c5f0f66e12baede0b705771e570906d369e"
    }
  ],
  "expected_effects_and_rollback_set_sha256": "a152afa30437e5e163bb0cfbeab7168330830c696289225089f40c1ddd47a4a9",
  "toolchain": [
    {
      "role": "GENERATOR",
      "path": "scripts/generate-executable-bundle.mjs",
      "sha256": "1e5a22e8613f8cc29bf7a93c08ff7c2fecbc1637c53c4fcb1cbf393f4a8010f2",
      "bytes": 16327,
      "observed_sha256": "1e5a22e8613f8cc29bf7a93c08ff7c2fecbc1637c53c4fcb1cbf393f4a8010f2"
    },
    {
      "role": "VERIFIER",
      "path": "scripts/verify-executable-bundle.mjs",
      "sha256": "c15fdce779060ccdf70ededced9a4a1224718481f16247f9e1bc47166b8df08b",
      "bytes": 4774,
      "observed_sha256": "c15fdce779060ccdf70ededced9a4a1224718481f16247f9e1bc47166b8df08b"
    }
  ],
  "toolchain_set_sha256": "a03a94618bb42469d336ba9d8304b7644f45b88512c11287472de0b642dde02f",
  "upstream_reviewed_inert_manifest_sha256": "ce85de2e32fca8497d7bb6380e51e3bc9d5717f1a07b25151414da5552075849",
  "redaction": {
    "aggregate_and_digest_only": true,
    "sql_bytes_in_receipts_forbidden": true,
    "raw_provider_payloads_forbidden": true,
    "credentials_and_secrets_forbidden": true,
    "machine_paths_forbidden": true
  },
  "action_time_placeholders": {
    "target_project_ref": "REQUIRED_AT_ACTION_TIME_NOT_SERIALIZED",
    "execution_run_id": "REQUIRED_AT_ACTION_TIME_NOT_SERIALIZED",
    "authority_event_id": "REQUIRED_AT_ACTION_TIME_NOT_SERIALIZED",
    "values_present": false
  }
}
